{
  "version": 2,
  "attempt_id": "20260810120002000000",
  "run_id": "20260810120000000000-adapter-pass",
  "project": "/workspace/acme",
  "route_fingerprint": "c0b9a1fcb09c9f6447e670bf4f93a7484d75e8044b7426382a9fa26ee63f3fa3",
  "codex_version": "codex-cli 0.146.0",
  "brief_sha256": "4444444444444444444444444444444444444444444444444444444444444444",
  "schema_sha256": "5555555555555555555555555555555555555555555555555555555555555555",
  "config": {
    "sandbox": "workspace-write",
    "approval_policy": "never",
    "user_config": "ignored",
    "execpolicy_rules": "ignored",
    "ephemeral": true,
    "git_repo_check": "required",
    "shell_environment_policy": "core",
    "json_events": true,
    "model": "gpt-5.6-terra",
    "effort": "medium",
    "output_schema_sha256": "5555555555555555555555555555555555555555555555555555555555555555",
    "timeout_seconds": 1200
  },
  "config_fingerprint": "5bc7fd4360f0727972522d405959937bff4e9caa2dd0a2bd749ef2e93dc133ee",
  "started_at": "2026-08-10T12:00:02+00:00",
  "finished_at": "2026-08-10T12:00:12+00:00",
  "dry_run": false,
  "duration_seconds": 10.0,
  "exit_code": 0,
  "result_status": "valid",
  "executor_status": "completed",
  "result_sha256": "c86ba4554f340c82b4cbad5434a677ff301519d4af7b6ba020d8af9eb53536f7"
}
